{
  "schema_version": "run-declaration-v1",
  "event_id": "declaration-fixture-1",
  "tenant_id": "tenant-fixture-a",
  "workflow_id": "reckoner",
  "workflow_version": "fixture-v1",
  "run_id": "run-fixture-1",
  "declared_at": "2026-09-26T10:00:00Z",
  "expected_task_count": 2,
  "expected_task_ids": ["a", "b"],
  "experiment_version": "fixture-experiment-v1",
  "cohort_version": "fixture-cohort-v1",
  "config_version": "fixture-config-v1",
  "code_revision": "fixture-revision",
  "dataset_version": "fixture-dataset-v1",
  "measurement_mode": "measured",
  "dataset_simulated": true,
  "replay": {
    "is_replay": true,
    "source_manifest_sha256": "aaaaaaaaaaaaaaaaaaaaaaaaaaaaaaaaaaaaaaaaaaaaaaaaaaaaaaaaaaaaaaaa"
  },
  "evaluation_suites": [
    {
      "suite_id": "fixture-deterministic",
      "suite_version": "v1",
      "expected_case_ids": ["a", "b"],
      "required_checks": ["correctness", "validity"]
    }
  ]
}
